{
  "schema_version": "0.1",
  "dataset_id": "pas_de_run_classical_reference_v0_1",
  "annotation_policy": {
    "audio_features": "Measured values only. Null when no local reference audio has been extracted.",
    "movement_demand": "Editorial 0..1 choreography-demand annotations grounded in the cited lineage; these are not audio measurements.",
    "movement_class": "Broad demand class, not an automatic ballet-step selection.",
    "gold_policy": "Gold denotes source-backed calibration material, not a claim that every modern staging preserves identical choreography.",
    "holdout_policy": "Holdout examples are validation-only and must not enter gold training/calibration sets."
  },
  "controlled_vocabulary": {
    "movement_function": ["PREPARE", "TRAVEL", "ACCENT", "RISE", "SUSTAIN", "BALANCE", "CONNECT", "CONTINUE", "RELEASE", "CLIMAX"],
    "movement_quality": ["light", "sharp", "floating", "controlled", "sustained", "energetic", "repeated"],
    "movement_class": ["TRAVEL", "ACCENT_ACTION", "SMALL_JUMP", "MEDIUM_JUMP", "LARGE_TRAVELLING_LEAP", "SUSTAINED_BALANCE", "TURN", "CONTROLLED_TRANSITION", "RECOVERY"]
  },
  "examples": [
    {
      "id": "nutcracker_sugar_plum_prepare_01",
      "dataset_split": "gold",
      "work": "The Nutcracker",
      "composer": "Pyotr Ilyich Tchaikovsky",
      "choreographic_lineage": "Sugar Plum Fairy variation; archival Labanotation catalog reference, staging-specific details not generalized",
      "segment": "Opening preparation and entry into the variation phrase",
      "provenance": {"source_type": "archival_catalog", "source_title": "Dance Notation Bureau Notated Theatrical Dances Catalog", "source_url": "https://www.dancenotation.org/ntd-catalog/", "confidence": "medium", "notes": "Catalog support establishes a preserved notated variation; this record stores no notation content and does not equate modern versions."},
      "music_alignment": {"measure_based": true, "audio_reference": null, "feature_status": "not_extracted", "audio_features": null},
      "movement_function": ["PREPARE", "CONNECT"],
      "movement_quality": ["controlled"],
      "movement_demand": {"travel": 0.2, "verticality": 0.25, "sustain": 0.6, "balance": 0.55, "rotation": 0.15, "movement_scale": 0.3, "technicality": 0.55},
      "movement_class": "CONTROLLED_TRANSITION",
      "repeat_structure": "Single preparatory unit leading into a larger phrase",
      "branching_relevance": "Low; useful as a phrase-entry prior",
      "annotation_confidence": 0.72
    },
    {
      "id": "nutcracker_sugar_plum_accent_travel_01",
      "dataset_split": "gold",
      "work": "The Nutcracker",
      "composer": "Pyotr Ilyich Tchaikovsky",
      "choreographic_lineage": "Sugar Plum Fairy variation; archival Labanotation catalog reference",
      "segment": "Articulated travelling and accent phrase",
      "provenance": {"source_type": "archival_catalog", "source_title": "Dance Notation Bureau Notated Theatrical Dances Catalog", "source_url": "https://www.dancenotation.org/ntd-catalog/", "confidence": "medium", "notes": "Demand labels are editorial abstractions; no step sequence or notation is reproduced."},
      "music_alignment": {"measure_based": true, "audio_reference": null, "feature_status": "not_extracted", "audio_features": null},
      "movement_function": ["ACCENT", "TRAVEL", "CONNECT"],
      "movement_quality": ["light", "sharp"],
      "movement_demand": {"travel": 0.65, "verticality": 0.45, "sustain": 0.25, "balance": 0.4, "rotation": 0.35, "movement_scale": 0.5, "technicality": 0.75},
      "movement_class": "ACCENT_ACTION",
      "repeat_structure": "Short articulated units recur within the variation",
      "branching_relevance": "Medium; accent realization may vary without changing function",
      "annotation_confidence": 0.7
    },
    {
      "id": "nutcracker_sugar_plum_repeated_rise_01",
      "dataset_split": "gold",
      "work": "The Nutcracker",
      "composer": "Pyotr Ilyich Tchaikovsky",
      "choreographic_lineage": "Sugar Plum Fairy variation; archival Labanotation catalog reference",
      "segment": "Repeated technical rise and continuation phrase",
      "provenance": {"source_type": "archival_catalog", "source_title": "Dance Notation Bureau Notated Theatrical Dances Catalog", "source_url": "https://www.dancenotation.org/ntd-catalog/", "confidence": "medium", "notes": "Used only as broad repeated-demand calibration; modern choreographic variants remain distinct."},
      "music_alignment": {"measure_based": true, "audio_reference": null, "feature_status": "not_extracted", "audio_features": null},
      "movement_function": ["RISE", "CONTINUE", "SUSTAIN"],
      "movement_quality": ["controlled", "repeated"],
      "movement_demand": {"travel": 0.35, "verticality": 0.7, "sustain": 0.6, "balance": 0.65, "rotation": 0.3, "movement_scale": 0.45, "technicality": 0.85},
      "movement_class": "CONTROLLED_TRANSITION",
      "repeat_structure": "Repeated technical cells with consistent control demand",
      "branching_relevance": "Medium; realization can scale by dancer level",
      "annotation_confidence": 0.68
    },
    {
      "id": "sleeping_beauty_rose_adagio_balance_01",
      "dataset_split": "gold",
      "work": "The Sleeping Beauty",
      "composer": "Pyotr Ilyich Tchaikovsky",
      "choreographic_lineage": "Petipa/Imperial lineage documented in the Sergeyev Collection; No. 8a Rose Adagio",
      "segment": "Prolonged supported balance sequence",
      "provenance": {"source_type": "historical_notation", "source_title": "The Sergeyev Collection", "source_url": "https://petipasociety.com/the-sergeyev-collection/", "confidence": "high", "notes": "Notation lineage supports the controlled-state model; no notation page or modern staging is copied."},
      "music_alignment": {"measure_based": true, "audio_reference": null, "feature_status": "not_extracted", "audio_features": null},
      "movement_function": ["PREPARE", "RISE", "BALANCE", "SUSTAIN"],
      "movement_quality": ["controlled", "sustained"],
      "movement_demand": {"travel": 0.15, "verticality": 0.65, "sustain": 0.98, "balance": 1.0, "rotation": 0.25, "movement_scale": 0.65, "technicality": 0.95},
      "movement_class": "SUSTAINED_BALANCE",
      "repeat_structure": "Extended balances recur with formal continuation",
      "branching_relevance": "High; duration and support conditions can scale difficulty",
      "annotation_confidence": 0.92
    },
    {
      "id": "sleeping_beauty_rose_adagio_continue_01",
      "dataset_split": "gold",
      "work": "The Sleeping Beauty",
      "composer": "Pyotr Ilyich Tchaikovsky",
      "choreographic_lineage": "Petipa/Imperial lineage documented in the Sergeyev Collection; No. 8a Rose Adagio",
      "segment": "Controlled continuation between balance states",
      "provenance": {"source_type": "scholarly_source", "source_title": "The Sergeyev Collection", "source_url": "https://petipasociety.com/the-sergeyev-collection/", "confidence": "high", "notes": "Encodes the lesson that balance can persist through transition rather than mean stillness."},
      "music_alignment": {"measure_based": true, "audio_reference": null, "feature_status": "not_extracted", "audio_features": null},
      "movement_function": ["BALANCE", "CONTINUE", "CONNECT"],
      "movement_quality": ["controlled", "sustained"],
      "movement_demand": {"travel": 0.35, "verticality": 0.55, "sustain": 0.9, "balance": 0.95, "rotation": 0.35, "movement_scale": 0.6, "technicality": 0.92},
      "movement_class": "CONTROLLED_TRANSITION",
      "repeat_structure": "Linked controlled states rather than isolated holds",
      "branching_relevance": "High; transition control can define route mastery",
      "annotation_confidence": 0.88
    },
    {
      "id": "sleeping_beauty_rose_adagio_release_01",
      "dataset_split": "gold",
      "work": "The Sleeping Beauty",
      "composer": "Pyotr Ilyich Tchaikovsky",
      "choreographic_lineage": "Petipa/Imperial lineage documented in the Sergeyev Collection; No. 8a Rose Adagio",
      "segment": "Release from prolonged controlled state",
      "provenance": {"source_type": "scholarly_source", "source_title": "The Sergeyev Collection", "source_url": "https://petipasociety.com/the-sergeyev-collection/", "confidence": "medium", "notes": "Broad release demand only; exact realization varies by reconstruction and staging."},
      "music_alignment": {"measure_based": true, "audio_reference": null, "feature_status": "not_extracted", "audio_features": null},
      "movement_function": ["CONTINUE", "RELEASE"],
      "movement_quality": ["controlled"],
      "movement_demand": {"travel": 0.3, "verticality": 0.35, "sustain": 0.6, "balance": 0.7, "rotation": 0.2, "movement_scale": 0.45, "technicality": 0.7},
      "movement_class": "RECOVERY",
      "repeat_structure": "Release resolves the extended balance phrase",
      "branching_relevance": "Medium; recovery quality can influence continuity",
      "annotation_confidence": 0.74
    },
    {
      "id": "giselle_act1_hops_01",
      "dataset_split": "gold",
      "work": "Giselle",
      "composer": "Adolphe Adam; Act I variation includes music by Riccardo Drigo",
      "choreographic_lineage": "Act I variation preserved in Stepanov notation associated with the 1903 Imperial production",
      "segment": "Thirty hops on the left pointe with repeated right-leg rond action",
      "provenance": {"source_type": "scholarly_source", "source_title": "Giselle: Ninety-Seven Questions, with Hundreds of Answers", "source_url": "https://www.alastairmacaulay.com/all-essays/giselle-questions-answers", "confidence": "high", "notes": "Expert discussion by Marian Smith, Doug Fullington, and Alexei Ratmansky describes the notated sequence and its historical limits."},
      "music_alignment": {"measure_based": true, "audio_reference": null, "feature_status": "not_extracted", "audio_features": null},